{
  "schemaVersion": "track-sdk-replay-fixture-v1",
  "ruleId": "safety_kernel_v0",
  "ruleVersion": "0.1.0",
  "source": "rust_infrastructure",
  "request": {
    "config": {},
    "input": {
      "sessionContext": {
        "sessionId": "mock-point",
        "strategyVersion": "rust-poc",
        "createdElapsedRealtimeNanos": 0,
        "createdWallTimeMillis": 0
      },
      "locationSamples": [
        {
          "sampleId": 1,
          "provider": "gnss",
          "lat": 30,
          "lng": 120,
          "horizontalAccuracyMeters": 8,
          "wallTimeMillis": 1000,
          "fixElapsedRealtimeNanos": 1000000000,
          "isMock": true
        }
      ],
      "samplingEpochs": [],
      "motionWindows": [],
      "barometerWindows": [],
      "barometerCalibrations": []
    }
  },
  "expected": {
    "trackPointCount": 0,
    "gpxTrackPointCount": 0,
    "segmentCount": 0,
    "totalDistanceMeters": 0,
    "totalDistanceMetersTolerance": 0.000001,
    "movingTimeSeconds": 0,
    "totalAscentMeters": 0,
    "totalDescentMeters": 0,
    "selectedElevationSource": "NONE",
    "acceptedSampleIds": [],
    "weakSampleIds": [],
    "rejectedSampleIds": [
      1
    ],
    "decisionReasons": {
      "1": "mock_location"
    },
    "decisionReasonCounts": {
      "mock_location": 1
    },
    "trackPoints": []
  }
}
