{
  "schemaVersion": "track-sdk-replay-fixture-v1",
  "ruleId": "gnss_ascent_descent_v0",
  "ruleVersion": "0.1.0",
  "source": "web_algorithm",
  "request": {
    "config": {
      "strategyVersion": "rust-poc"
    },
    "input": {
      "sessionContext": {
        "sessionId": "gnss-ascent-descent",
        "strategyVersion": "rust-poc",
        "createdElapsedRealtimeNanos": 0,
        "createdWallTimeMillis": 0
      },
      "locationSamples": [
        {
          "sampleId": 1,
          "provider": "gnss",
          "lat": 30,
          "lng": 120,
          "horizontalAccuracyMeters": 8,
          "altitudeMeters": 100,
          "verticalAccuracyMeters": 4,
          "wallTimeMillis": 1000,
          "fixElapsedRealtimeNanos": 1000000000,
          "isMock": false
        },
        {
          "sampleId": 2,
          "provider": "gnss",
          "lat": 30.0001,
          "lng": 120,
          "horizontalAccuracyMeters": 8,
          "altitudeMeters": 110,
          "verticalAccuracyMeters": 4,
          "wallTimeMillis": 31000,
          "fixElapsedRealtimeNanos": 31000000000,
          "isMock": false
        },
        {
          "sampleId": 3,
          "provider": "gnss",
          "lat": 30.0002,
          "lng": 120,
          "horizontalAccuracyMeters": 8,
          "altitudeMeters": 104,
          "verticalAccuracyMeters": 4,
          "wallTimeMillis": 61000,
          "fixElapsedRealtimeNanos": 61000000000,
          "isMock": false
        }
      ],
      "samplingEpochs": [],
      "motionWindows": [],
      "barometerWindows": [],
      "barometerCalibrations": []
    }
  },
  "expected": {
    "trackPointCount": 2,
    "gpxTrackPointCount": 2,
    "segmentCount": 1,
    "totalDistanceMeters": 22.23898532886,
    "totalDistanceMetersTolerance": 0.000001,
    "movingTimeSeconds": 60,
    "totalAscentMeters": 4,
    "totalDescentMeters": 0,
    "selectedElevationSource": "GNSS",
    "acceptedSampleIds": [
      1,
      3
    ],
    "weakSampleIds": [],
    "rejectedSampleIds": [
      2
    ],
    "decisionReasons": {
      "1": "first_fix_good",
      "2": "stationary_cloud_jitter",
      "3": "moving_good_fix"
    },
    "decisionReasonCounts": {
      "first_fix_good": 1,
      "moving_good_fix": 1,
      "stationary_cloud_jitter": 1
    },
    "trackPoints": [
      {
        "sourceSampleId": 1,
        "lat": 30,
        "lng": 120
      },
      {
        "sourceSampleId": 3,
        "lat": 30.0002,
        "lng": 120
      }
    ]
  }
}
