{
  "schemaVersion": "track-sdk-replay-fixture-v1",
  "ruleId": "position_snap_recovery_anchor_v0",
  "ruleVersion": "0.1.0",
  "source": "web_algorithm",
  "request": {
    "config": {
      "strategyVersion": "rust-poc"
    },
    "input": {
      "sessionContext": {
        "sessionId": "position-snap-recovery-anchor",
        "strategyVersion": "rust-poc",
        "createdElapsedRealtimeNanos": 0,
        "createdWallTimeMillis": 0
      },
      "locationSamples": [
        {
          "sampleId": 1,
          "provider": "gnss",
          "lat": 30,
          "lng": 120,
          "horizontalAccuracyMeters": 8,
          "wallTimeMillis": 1000,
          "fixElapsedRealtimeNanos": 1000000000,
          "isMock": false
        },
        {
          "sampleId": 2,
          "provider": "gnss",
          "lat": 30.0004,
          "lng": 120,
          "horizontalAccuracyMeters": 8,
          "speedMetersPerSecond": 1,
          "wallTimeMillis": 11000,
          "fixElapsedRealtimeNanos": 11000000000,
          "isMock": false
        },
        {
          "sampleId": 3,
          "provider": "gnss",
          "lat": 30.0002,
          "lng": 120,
          "horizontalAccuracyMeters": 8,
          "speedMetersPerSecond": 1,
          "wallTimeMillis": 12000,
          "fixElapsedRealtimeNanos": 12000000000,
          "isMock": false
        }
      ],
      "samplingEpochs": [],
      "motionWindows": [],
      "barometerWindows": [],
      "barometerCalibrations": []
    }
  },
  "expected": {
    "trackPointCount": 2,
    "gpxTrackPointCount": 2,
    "segmentCount": 1,
    "totalDistanceMeters": 0,
    "totalDistanceMetersTolerance": 0.000001,
    "movingTimeSeconds": 0,
    "totalAscentMeters": 0,
    "totalDescentMeters": 0,
    "selectedElevationSource": "NONE",
    "acceptedSampleIds": [
      1,
      3
    ],
    "weakSampleIds": [
      2
    ],
    "rejectedSampleIds": [],
    "decisionReasons": {
      "1": "first_fix_good",
      "2": "implied_speed_unconfirmed_by_reported_speed",
      "3": "position_snap_recovery_anchor"
    },
    "decisionReasonCounts": {
      "first_fix_good": 1,
      "implied_speed_unconfirmed_by_reported_speed": 1,
      "position_snap_recovery_anchor": 1
    },
    "trackPoints": [
      {
        "sourceSampleId": 1,
        "lat": 30,
        "lng": 120
      },
      {
        "sourceSampleId": 3,
        "lat": 30.0002,
        "lng": 120
      }
    ]
  }
}
