{
  "schemaVersion": "track-sdk-replay-fixture-v1",
  "ruleId": "horizontal_decision.transport_risk_reported_speed",
  "ruleVersion": "0.1.0",
  "source": "web_algorithm",
  "request": {
    "config": {
      "strategyVersion": "rust-poc"
    },
    "input": {
      "sessionContext": {
        "sessionId": "transport-risk-reported-speed",
        "strategyVersion": "rust-poc",
        "createdElapsedRealtimeNanos": 0,
        "createdWallTimeMillis": 0
      },
      "locationSamples": [
        {
          "sampleId": 1,
          "provider": "gnss",
          "lat": 30,
          "lng": 120,
          "horizontalAccuracyMeters": 8,
          "wallTimeMillis": 1000,
          "fixElapsedRealtimeNanos": 1000000000,
          "isMock": false
        },
        {
          "sampleId": 2,
          "provider": "gnss",
          "lat": 30.0004,
          "lng": 120,
          "horizontalAccuracyMeters": 8,
          "speedMetersPerSecond": 4,
          "wallTimeMillis": 11000,
          "fixElapsedRealtimeNanos": 11000000000,
          "isMock": false
        },
        {
          "sampleId": 3,
          "provider": "gnss",
          "lat": 30.0001,
          "lng": 120,
          "horizontalAccuracyMeters": 8,
          "wallTimeMillis": 12000,
          "fixElapsedRealtimeNanos": 12000000000,
          "isMock": false
        }
      ],
      "samplingEpochs": [],
      "motionWindows": [],
      "barometerWindows": [],
      "barometerCalibrations": []
    }
  },
  "expected": {
    "trackPointCount": 1,
    "gpxTrackPointCount": 1,
    "segmentCount": 1,
    "totalDistanceMeters": 0,
    "totalDistanceMetersTolerance": 0.000001,
    "movingTimeSeconds": 0,
    "totalAscentMeters": 0,
    "totalDescentMeters": 0,
    "selectedElevationSource": "NONE",
    "acceptedSampleIds": [
      1
    ],
    "weakSampleIds": [],
    "rejectedSampleIds": [
      2,
      3
    ],
    "decisionReasons": {
      "1": "first_fix_good",
      "2": "transport_risk",
      "3": "stationary_cloud_jitter"
    },
    "decisionReasonCounts": {
      "first_fix_good": 1,
      "stationary_cloud_jitter": 1,
      "transport_risk": 1
    },
    "trackPoints": [
      {
        "sourceSampleId": 1,
        "lat": 30,
        "lng": 120
      }
    ]
  }
}
