{
  "schemaVersion": "track-sdk-replay-fixture-v1",
  "ruleId": "web_intake_v0",
  "ruleVersion": "0.1.0",
  "source": "web_algorithm",
  "request": {
    "config": {},
    "input": {
      "sessionContext": {
        "sessionId": "sampling-epoch-mismatch",
        "strategyVersion": "rust-poc",
        "createdElapsedRealtimeNanos": 0,
        "createdWallTimeMillis": 0
      },
      "samplingEpochs": [
        {
          "epochId": "active",
          "state": "MOVING",
          "startedElapsedRealtimeNanos": 0,
          "requestedMinTimeMs": 1000,
          "requestedMinDistanceMeters": 1
        }
      ],
      "locationSamples": [
        {
          "sampleId": 1,
          "provider": "gnss",
          "lat": 30,
          "lng": 120,
          "horizontalAccuracyMeters": 8,
          "wallTimeMillis": 1000,
          "fixElapsedRealtimeNanos": 1000000000,
          "samplingEpochId": "missing",
          "isMock": false
        }
      ],
      "motionWindows": [],
      "barometerWindows": [],
      "barometerCalibrations": []
    }
  },
  "expected": {
    "trackPointCount": 0,
    "gpxTrackPointCount": 0,
    "segmentCount": 0,
    "totalDistanceMeters": 0,
    "totalDistanceMetersTolerance": 0.000001,
    "movingTimeSeconds": 0,
    "totalAscentMeters": 0,
    "totalDescentMeters": 0,
    "selectedElevationSource": "NONE",
    "acceptedSampleIds": [],
    "weakSampleIds": [],
    "rejectedSampleIds": [
      1
    ],
    "decisionReasons": {
      "1": "sampling_epoch_mismatch"
    },
    "decisionReasonCounts": {
      "sampling_epoch_mismatch": 1
    },
    "trackPoints": []
  }
}
