{
  "schemaVersion": "track-sdk-replay-fixture-v1",
  "ruleId": "web_first_fix_v0",
  "ruleVersion": "0.1.0",
  "source": "web_algorithm",
  "request": {
    "config": {},
    "input": {
      "sessionContext": {
        "sessionId": "first-fix-weak-horizontal-accuracy",
        "strategyVersion": "rust-poc",
        "createdElapsedRealtimeNanos": 0,
        "createdWallTimeMillis": 0
      },
      "locationSamples": [
        {
          "sampleId": 1,
          "provider": "gnss",
          "lat": 30,
          "lng": 120,
          "horizontalAccuracyMeters": 35,
          "wallTimeMillis": 1000,
          "fixElapsedRealtimeNanos": 1000000000,
          "isMock": false
        },
        {
          "sampleId": 2,
          "provider": "gnss",
          "lat": 30.0001,
          "lng": 120,
          "horizontalAccuracyMeters": 8,
          "wallTimeMillis": 2000,
          "fixElapsedRealtimeNanos": 2000000000,
          "isMock": false
        }
      ],
      "samplingEpochs": [],
      "motionWindows": [],
      "barometerWindows": [],
      "barometerCalibrations": []
    }
  },
  "expected": {
    "trackPointCount": 1,
    "gpxTrackPointCount": 1,
    "segmentCount": 1,
    "totalDistanceMeters": 0,
    "totalDistanceMetersTolerance": 0.000001,
    "movingTimeSeconds": 0,
    "totalAscentMeters": 0,
    "totalDescentMeters": 0,
    "selectedElevationSource": "NONE",
    "acceptedSampleIds": [
      2
    ],
    "weakSampleIds": [
      1
    ],
    "rejectedSampleIds": [],
    "decisionReasons": {
      "1": "weak_horizontal_accuracy",
      "2": "first_fix_good"
    },
    "decisionReasonCounts": {
      "first_fix_good": 1,
      "weak_horizontal_accuracy": 1
    },
    "trackPoints": [
      {
        "sourceSampleId": 2,
        "lat": 30.0001,
        "lng": 120
      }
    ]
  }
}
